{
  "name": "sc-030: 気力ゼロ状態",
  "description": "BASE:1 (気力) = 0 の状態で日常コマンドが制限されることを確認",
  "add_characters": [1],
  "characters": {
    "紅美鈴": {
      "BASE:1": 0,
      "MAXBASE:1": 1000,
      "CFLAG:2": 1000
    }
  },
  "copy": [
    {"from": "紅美鈴", "to": "MASTER", "var": "CFLAG:300"}
  ],
  "expect": {
    "output_contains": ["[100]"]
  }
}
