{
  "name": "sc-046: 日終了リセット",
  "description": "EVENTTURNEND/EVENTTRAIN時に勃起度、汚れ、TEQUIPがリセットされることを確認",
  "add_characters": [1],
  "characters": {
    "紅美鈴": {
      "CFLAG:勃起度": 100,
      "CFLAG:汚れ発覚": 1,
      "CFLAG:汚れ継続時間": 10,
      "TEQUIP:Vセックス": 1,
      "TEQUIP:Aセックス": 1,
      "CFLAG:2": 1000
    }
  },
  "copy": [
    {"from": "紅美鈴", "to": "MASTER", "var": "CFLAG:300"}
  ],
  "expect": {
    "output_contains": ["[100]"]
  }
}
